{
  "greeting": "你好呀！",
  "name": "程培君大朋友",
  "greetingText": "猜猜今天是什么日子！",
  "wishText": "恭喜你！今天26岁啦！",
  "imagePath": "img/lydia2.png",
  "text1": "没想到吧！我们又一次同岁了！",
  "textInChatBox": "武汉和深圳的距离还是有一些的，但是没关系！",
  "sendButtonLabel": "祝福不会迟到！爱意不会消减！",
  "text2": "生日快乐！",
  "text3": "新的一岁",
  "text4": "希望你拥有更多的底气和勇气去做你想做的任何事情",
  "text4Adjective": "无论你做什么",
  "text5Entry": "我都会无条件的支持你！",
  "text5Content": "我们好像真的变成大人了",
  "smiley": ":)",
  "bigTextPart1": "我们有能力，有条件，去完成以前的畅想",
  "bigTextPart2": "我也相信",
  "wishHeading": "未来的我们肯定会比现在更好！",
  "outroText": "生日快乐！大培培！",
  "replayText": "未来我们还有无限可能！爱你！冲！",
  "outroSmiley": ":)",
  "music": "./music/bgMusic.mp3",
  "fonts": [
    {
      "name": "Ma Shan Zheng",
      "path": "https://fonts.googleapis.com/css?family=Ma+Shan+Zheng&display=swap"
    }
  ]
}

